{
  "schema": "polkadot-host-capabilities/run@1",
  "key": "2026-09-19_codec1_host-0.19.1_android-16_1131",
  "capturedAt": "2026-09-19T11:31:01.212Z",
  "complete": true,
  "notes": [
    "First run with sonde's limit probes. Opt-in probes (slow, spends-quota, crash-risk) were not selected.",
    "SDK versions are sonde's exact pins at this build (its package.json); the markdown report does not carry them.",
    "Picked file names and the product account are redacted."
  ],
  "tool": {
    "name": "sonde",
    "version": "1.0.0",
    "build": "2026-09-19T11:21:00.861Z",
    "source": "https://github.com/Baronvonbonbon/sonde",
    "runId": "45fcee52-c839-4e29-b8b1-7d6aa7c2f1e6",
    "productId": "sondeprobes"
  },
  "runtime": {
    "surface": "polkadot-app",
    "os": "Android 16.0.0",
    "device": "Pixel 10 Pro XL",
    "webview": "Chromium 152.0.7977.87",
    "appVersion": null
  },
  "host": {
    "wireCodec": 1,
    "truapi": 1,
    "sdk": {
      "@parity/product-sdk": "0.27.0",
      "@parity/product-sdk-host": "0.19.1",
      "@parity/product-sdk-keys": "0.3.24",
      "@parity/product-sdk-statement-store": "0.6.9",
      "@parity/product-sdk-terminal": "0.8.2",
      "@parity/truapi": "0.13.1"
    }
  },
  "results": {
    "host.system.container": {
      "title": "Host container detection",
      "status": "pass",
      "diagnosis": null,
      "ms": 1,
      "detail": "Running inside the Polkadot host container."
    },
    "host.system.handshake": {
      "title": "TrUApi handshake",
      "status": "pass",
      "diagnosis": null,
      "ms": 70,
      "detail": "Handshake completed in 67 ms."
    },
    "host.system.version": {
      "title": "App version — is one exposed at all?",
      "status": "unsupported",
      "diagnosis": "not-implemented",
      "ms": 1,
      "detail": "No host API returns an app version. Reports from different builds cannot be attributed to those builds, which is the single largest gap in making these results comparable."
    },
    "host.system.createApp": {
      "title": "createApp — construct the SDK App",
      "status": "pass",
      "diagnosis": null,
      "ms": 85,
      "detail": "App constructed on the configured environment."
    },
    "host.system.featureSupported": {
      "title": "featureSupported / isChainSupported",
      "status": "pass",
      "diagnosis": null,
      "ms": 36,
      "detail": "Queried the host's chain support."
    },
    "host.system.navigateTo": {
      "title": "navigateTo",
      "status": "pass",
      "diagnosis": null,
      "ms": 34,
      "detail": "Host accepted the navigation request."
    },
    "host.localStorage.roundTrip": {
      "title": "Host local storage — string, JSON, bytes",
      "status": "pass",
      "diagnosis": null,
      "ms": 54,
      "detail": "All three value types round-trip."
    },
    "host.theme.subscribe": {
      "title": "Theme subscription",
      "status": "pass",
      "diagnosis": null,
      "ms": 2502,
      "detail": "Received 1 theme update(s)."
    },
    "host.chain.genesis": {
      "title": "Chain spec — genesis, name, properties",
      "status": "pass",
      "diagnosis": null,
      "ms": 24288,
      "detail": "Spec from: Paseo Asset Hub. No answer: Paseo Bulletin Next, Paseo People Next, Paseo Asset Hub Next, Polkadot Asset Hub. Genesis 0xd6eec26135… is the reference for the T3 allowlist."
    },
    "host.chain.provider": {
      "title": "Host JSON-RPC provider",
      "status": "pass",
      "diagnosis": null,
      "ms": 42,
      "detail": "Host provider constructed."
    },
    "host.notifications.push": {
      "title": "Host push notification",
      "status": "pass",
      "diagnosis": null,
      "ms": 2588,
      "detail": "Host accepted a push notification."
    },
    "host.chat.list": {
      "title": "Chat — list subscription",
      "status": "pass",
      "diagnosis": null,
      "ms": 2501,
      "detail": "Chat namespace reachable; 0 room(s) visible."
    },
    "host.payment.balance": {
      "title": "Payment — balance subscription (read-only)",
      "status": "fail",
      "diagnosis": "wrong-result",
      "ms": 3002,
      "detail": "Subscribed but no balance arrived in 3 s — not even a zero.",
      "evidence": "A Product cannot show a balance, or decide whether it can afford anything."
    },
    "host.preimage.lookup": {
      "title": "Preimage lookup (read-only)",
      "status": "fail",
      "diagnosis": "wrong-result",
      "ms": 5004,
      "detail": "Lookup never called back in 5 s — neither a hit nor a miss.",
      "evidence": "Calling code cannot distinguish 'still looking' from 'never will'."
    },
    "host.account.userId": {
      "title": "getUserId",
      "status": "pass",
      "diagnosis": null,
      "ms": 2495,
      "detail": "Returned a user id."
    },
    "host.account.productAccounts": {
      "title": "Per-index product account derivation",
      "status": "pass",
      "diagnosis": null,
      "ms": 1016,
      "detail": "4 distinct key(s) across indices — per-index accounts are derivable."
    },
    "host.account.legacyAccounts": {
      "title": "getLegacyAccounts",
      "status": "pass",
      "diagnosis": null,
      "ms": 7,
      "detail": "0 legacy account(s)."
    },
    "host.account.deriveEntropy": {
      "title": "deriveEntropy — determinism",
      "status": "pass",
      "diagnosis": null,
      "ms": 84,
      "detail": "Deterministic: the same input gives the same entropy."
    },
    "host.account.eip712": {
      "title": "EIP-712 with an app-local burner key",
      "status": "pass",
      "diagnosis": null,
      "ms": 119,
      "detail": "Signed and recovered in 4 ms — a contract's ecrecover would accept this."
    },
    "host.account.connect": {
      "title": "wallet.connect + selectAccount",
      "status": "pass",
      "diagnosis": null,
      "ms": 1029,
      "detail": "Connected and selected an account."
    },
    "host.account.anonymousAlias": {
      "title": "Ring VRF anonymous alias",
      "status": "unsupported",
      "diagnosis": "not-implemented",
      "ms": 1,
      "detail": "getAnonymousAlias() returned null — no alias in this runtime."
    },
    "host.account.signMessage": {
      "title": "wallet.signMessage",
      "status": "pass",
      "diagnosis": null,
      "ms": 1933,
      "detail": "Signed (64 bytes)."
    },
    "host.limits.retention": {
      "title": "Bulletin retention — can earlier uploads still be read?",
      "status": "skip",
      "diagnosis": null,
      "ms": 32,
      "detail": "No earlier uploads to look up yet — the T3 upload probes record what they store, and the next run checks it."
    },
    "host.cloud.read": {
      "title": "Cloud storage read (no signature needed)",
      "status": "pass",
      "diagnosis": null,
      "ms": 186,
      "detail": "Fetched 0.1 KiB in 186 ms and the CID verifies. Reads work."
    },
    "host.cloud.seal": {
      "title": "Seal under a crypto-shred key (WebCrypto)",
      "status": "pass",
      "diagnosis": null,
      "ms": 1,
      "detail": "Sealed a placeholder in 0 ms (run the camera probe first for a real payload)."
    },
    "host.statement.subscribe": {
      "title": "Statement Store — subscribe (read-only)",
      "status": "pass",
      "diagnosis": null,
      "ms": 6003,
      "detail": "1 page(s) delivered."
    },
    "host.statement.createProof": {
      "title": "Statement Store — createProofAuthorized",
      "status": "pass",
      "diagnosis": null,
      "ms": 2211,
      "detail": "Host produced an authorized proof."
    },
    "host.cloud.allowance": {
      "title": "Request a Bulletin allowance",
      "status": "pass",
      "diagnosis": null,
      "ms": 17758,
      "detail": "Allocated, and the App was rebuilt so cloud storage picks up the slot account."
    },
    "host.cloud.upload": {
      "title": "Cloud storage upload (canary, then payload)",
      "status": "fail",
      "diagnosis": "allowance-missing",
      "ms": 2382,
      "detail": "Even a ~26-byte upload failed — this is not a size problem.",
      "evidence": "account               : <product account #0>\ncanary (26B)          : failed — {\"isSdkError\":true,\"source\":\"cloud-storage\",\"name\":\"ProductCloudStorageError\"}\nThe allowance request DOES raise a prompt, so the host can surface them. A store\nthat produces none is therefore not a permission callback going unanswered.\nEither the write is sponsored by the slot account and never needed a tap and is\nhanging earlier, or it never reaches the signing path at all. Either way it\nshould reject rather than stall.\nKnown since almanac P6 (2026-09-14): cloudStorage.upload signs with product account #0,\nwhich holds no Bulletin authorization, so it is refused (Invalid: Payment). The\nallowance lands on a slot account only the host can sign with — host.preimage.submit\ntests that route."
    },
    "host.cloud.roundTrip": {
      "title": "Fetch → CID verify → decrypt",
      "status": "skip",
      "diagnosis": null,
      "ms": null,
      "detail": "Needs \"host.cloud.upload\", which came back fail. Running anyway would test a placeholder."
    },
    "host.preimage.submit": {
      "title": "Preimage submit — upload through the host, then read it back",
      "status": "skip",
      "diagnosis": null,
      "ms": null,
      "detail": "Needs \"host.cloud.allowance\", which has not run yet.",
      "retracted": "Not measured: it depended on host.cloud.allowance, a gesture probe that always runs after the unattended ones. Fixed in sonde (a4683ff): it requests the allowance itself."
    },
    "host.statement.submit": {
      "title": "Statement Store — submit",
      "status": "pass",
      "diagnosis": null,
      "ms": 2061,
      "detail": "Statement submitted."
    },
    "host.limits.bridgePayload": {
      "title": "Largest message the host accepts",
      "status": "fail",
      "diagnosis": "wrong-result",
      "ms": 28,